問題,選択肢1,選択肢2,選択肢3,選択肢4,正解,解説,科目,回
星座で、Wの形に見える星座は何ですか？,カシオペヤ座,オリオン座,北斗七星,こと座,1,カシオペヤ座はWの形をしています。,理科,14
冬の星座で、三つ星が目印の星座は何ですか？,オリオン座,カシオペヤ座,北斗七星,こと座,1,オリオン座は中央に三つ星が並んでいます。,理科,14
夏の大三角を作る星に含まれないものはどれですか？,シリウス,ベガ,アルタイル,デネブ,1,夏の大三角はベガ・アルタイル・デネブです。シリウスは冬の星です。,理科,14
冬の大三角を作る星に含まれないものはどれですか？,ベガ,シリウス,ベテルギウス,プロキオン,1,冬の大三角はシリウス・ベテルギウス・プロキオンです。ベガは夏の星です。,理科,14
星が1日に1回、東から西へ動いて見える動きを何といいますか？,日周運動,年周運動,自転,公転,1,日周運動は地球の自転によって起こります。,理科,14
星座が1年かけて同じ時刻に位置を変える動きを何といいますか？,年周運動,日周運動,自転,公転,1,年周運動は地球の公転によって起こります。,理科,14
北極星の見つけ方で正しいものはどれですか？,北斗七星を使う,オリオン座を使う,太陽を使う,月を使う,1,北斗七星の先端の2つの星を延長すると北極星が見つかります。,理科,14
夏の夜空に見える、さそり座の赤い1等星は何ですか？,アンタレス,ベテルギウス,アルデバラン,スピカ,1,アンタレスはさそり座の1等星で赤く見えます。,理科,14
天の川が最もよく見える季節はいつですか？,夏,冬,春,秋,1,天の川は夏の夜空に最もよく見えます。,理科,14
秋田県の県庁所在地はどこですか？,秋田,大館,横手,能代,1,秋田県の県庁所在地は秋田市です。,社会,14
秋田県の特産品で有名な鍋は何ですか？,きりたんぽ鍋,ちゃんこ鍋,石狩鍋,水炊き,1,きりたんぽは秋田県の郷土料理です。,社会,14
秋田県の名物として有名な麺は何ですか？,稲庭うどん,讃岐うどん,水沢うどん,五島うどん,1,稲庭うどんは秋田県の特産品です。,社会,14
青森県の県庁所在地はどこですか？,青森,弘前,八戸,むつ,1,青森県の県庁所在地は青森市です。,社会,14
青森県の鉄道で本州と北海道を結ぶ海底トンネルは何ですか？,青函トンネル,関門トンネル,東京湾アクアライン,瀬戸大橋,1,青函トンネルは本州（青森県）と北海道を結ぶ海底トンネルです。,社会,14
青森県で有名な果物は何ですか？,りんご,みかん,桃,ぶどう,1,青森県はりんごの生産量が日本一です。,社会,14
青森県で日光を遮らずに育てるりんごは何ですか？,サンふじ,紅玉,王林,ジョナゴールド,1,袋をかけずに太陽の光をたっぷり浴びて育てたりんごを「サンふじ」と呼びます。,社会,14
青森県の気候で、夏に太平洋側から吹く冷たく湿った風を何といいますか？,やませ,からっ風,だし,おろし,1,やませは冷害の原因となる冷たい風です。,社会,14
秋田県の男鹿半島で有名な伝統行事は何ですか？,なまはげ,ねぶた,竿燈,花笠,1,なまはげは秋田県男鹿半島の伝統行事です。,社会,14
青森県で夏に行われる火祭りは何ですか？,ねぶた祭り,竿燈まつり,七夕祭り,花笠まつり,1,ねぶた祭りは青森県の夏の代表的な祭りです。,社会,14
